{
  "schema_version": 1,
  "proposal_id": "proposal-0001",
  "decision": "RETRY",
  "subject": { "type": "task", "id": "task-123" },
  "capability": "demo.verify",
  "arguments": {},
  "provider": {
    "provider_type": "RULES",
    "provider_id": "rules.v1",
    "provider_version": "0.1.0"
  },
  "reason": "retryable WORKER_TIMEOUT within budget (0/2)",
  "evidence": [],
  "proposed_at": "2026-10-01T00:00:00Z"
}
